{
  "slice_id": "slice-003",
  "verdict": "approved",
  "timestamp": "2026-04-12T13:51:36Z",
  "ac_assessment": [
    {
      "ac": "AC-001",
      "met": true,
      "confidence": "high",
      "notes": "Job php-lint executa 'vendor/bin/pint --test' (ci.yml:95). Trigger push.branches=['**'] garante execução em feature branches (CiTriggerTest.php). Teste de runtime executa Pint real contra código mal formatado e verifica exit != 0 (CiRuntimeTest.php). Comportamento corresponde exatamente ao AC."
    },
    {
      "ac": "AC-002",
      "met": true,
      "confidence": "high",
      "notes": "Job php-static executa 'phpstan analyse --memory-limit=2G --no-progress' (ci.yml:140). Teste de runtime injeta erro de tipo em arquivo temporário e verifica exit != 0 com phpstan --level=8 (CiRuntimeTest.php). Trigger cobre feature branches. Comportamento corresponde ao AC."
    },
    {
      "ac": "AC-003",
      "met": true,
      "confidence": "high",
      "notes": "Job php-test executa 'pest --ci' com serviço PostgreSQL 18 (ci.yml:229). Teste de runtime cria teste falhando em arquivo temporário e verifica exit != 0 (CiRuntimeTest.php). Trigger cobre feature branches. Comportamento corresponde ao AC."
    },
    {
      "ac": "AC-004",
      "met": true,
      "confidence": "high",
      "notes": "Todos os 7 jobs exigidos pelo plan estão presentes: harness, php-lint, php-static, php-test, js-lint, security, php-rector (CiJobsTest.php). Todos os jobs PHP contêm 'needs: harness' garantindo encadeamento (CiRuntimeTest.php). Rector executa com --dry-run (ci.yml:274). Pipeline completo para check verde no GitHub."
    },
    {
      "ac": "AC-005",
      "met": true,
      "confidence": "medium",
      "notes": "SBOM é gerado como sbom-php.xml (ci.yml:372) sem || true nos steps CycloneDX. upload-artifact está configurado com retention-days: 30 (ci.yml:374-380). Confiança 'medium' por dois motivos: (1) o spec descreve o artefato como 'sbom.xml' mas a implementação gera 'sbom-php.xml' — divergência de nomenclatura sem impacto funcional confirmável localmente; (2) upload-artifact usa condição 'hashFiles(sbom-php.xml) != empty' que faria o step ser skipped se a geração falhar antes — contudo, como o step de geração não tem || true, a falha já causa exit 1 no job antes do upload, minimizando risco real."
    }
  ],
  "ux_findings": [],
  "consistency_findings": [
    {
      "id": "CON-001",
      "severity": "low",
      "description": "O spec (AC-005) refere o artefato como 'sbom.xml' mas a implementação gera 'sbom-php.xml' e os testes validam 'sbom-php.xml'. A jornada descrita no spec ('artefato sbom.xml disponível na aba Artifacts') é atendida funcionalmente, mas o nome diverge do spec literal.",
      "recommendation": "Atualizar o spec para referenciar 'sbom-php.xml' ou adicionar alias no upload-artifact com name: 'sbom' apontando para o arquivo correto — o que já ocorre na implementação atual (artifact name: 'sbom', path: 'sbom-php.xml')."
    }
  ],
  "business_rule_findings": [],
  "next_action": "approved"
}
