{
  "slice_id": "slice-900",
  "verdict": "approved",
  "timestamp": "2026-04-11T00:00:00Z",
  "ac_assessment": [
    {
      "ac": "AC-001",
      "met": true,
      "confidence": "high",
      "notes": "Arquivo src/Utils/Greeting.php existe com metodo greet(string $name): string retornando 'Hello, {name}!'. Testes passam com exit 0."
    },
    {
      "ac": "AC-002",
      "met": true,
      "confidence": "high",
      "notes": "greet('') retorna 'Hello, World!' conforme logica condicional. Teste passa com exit 0."
    },
    {
      "ac": "AC-003",
      "met": true,
      "confidence": "high",
      "notes": "3 testes Pest cobrindo AC-001 (2 testes) e AC-002 (1 teste). Todos passam: 3 passed (3 assertions), exit 0."
    }
  ],
  "ux_findings": [],
  "consistency_findings": [],
  "business_rule_findings": [],
  "next_action": "approved"
}
