{
  "slice_id": "slice-005",
  "verdict": "approved",
  "timestamp": "2026-04-13T01:09:03Z",
  "ac_assessment": [
    {
      "ac": "AC-001",
      "met": true,
      "confidence": "high",
      "notes": "Dois testes cobrem o cenário: HTTP 200 retornado e 'status':'ok' no JSON quando DB e Redis respondem. Pest exit 0, 15 testes passaram."
    },
    {
      "ac": "AC-002",
      "met": true,
      "confidence": "high",
      "notes": "Três testes verificam a resposta local: assertJsonStructure(['status','db','redis','timestamp']), valores 'connected' em db e redis, e formato ISO 8601 com timezone via regex. Um teste adicional confirma que chamadas de IP externo recebem status/timestamp sem detalhes internos."
    },
    {
      "ac": "AC-003",
      "met": true,
      "confidence": "high",
      "notes": "Dois testes cobrem falha de DB (HTTP 503, status 'degraded', db 'disconnected') e falha de Redis (HTTP 503, redis 'disconnected'). Lógica de try/catch no controller captura exceptions sem propagar. Comportamento parcial (só um componente falha) também coberto."
    },
    {
      "ac": "AC-004",
      "met": true,
      "confidence": "high",
      "notes": "Suite com 15 testes (superando o mínimo de 3). Testes mapeados aos grupos 'ac-001', 'ac-002', 'ac-003' incluem os cenários ok, db-fail e redis-fail exigidos. Pest exit 0 confirmado."
    },
    {
      "ac": "AC-005",
      "met": true,
      "confidence": "high",
      "notes": "Teste AC-005 executa phpstan analyse --level=8 no HealthCheckController.php via exec() e valida exit code 0. Pest confirmou que este teste passou (5.09s de execução, incluindo análise real do PHPStan)."
    }
  ],
  "ux_findings": [],
  "consistency_findings": [],
  "business_rule_findings": [],
  "next_action": "approved"
}
