{
  "slice_id": "slice-006",
  "verdict": "approved",
  "timestamp": "2026-04-13T00:36:43.6594048-04:00",
  "ac_assessment": [
    {
      "ac": "AC-001",
      "met": true,
      "confidence": "high",
      "notes": "npm run build retornou exit 0 e gerou manifest com resources/js/app.js e resources/css/app.css; layout app referencia as entradas via @vite."
    },
    {
      "ac": "AC-002",
      "met": true,
      "confidence": "high",
      "notes": "GET /ping fora de production retornou HTTP 200 e o HTML contem Livewire OK."
    },
    {
      "ac": "AC-003",
      "met": true,
      "confidence": "high",
      "notes": "Manifest gerado contem arquivos versionados por hash para JS e CSS, e /ping referencia os assets versionados."
    },
    {
      "ac": "AC-004",
      "met": true,
      "confidence": "high",
      "notes": "PHPStan nivel 8 no componente App\\Livewire\\Ping retornou exit 0."
    },
    {
      "ac": "AC-005",
      "met": true,
      "confidence": "high",
      "notes": "php artisan livewire:list retornou exit 0 e listou o componente ping."
    },
    {
      "ac": "AC-006",
      "met": true,
      "confidence": "high",
      "notes": "A validacao do manifest falha explicitamente quando uma entrada Vite obrigatoria esta ausente."
    },
    {
      "ac": "AC-007",
      "met": true,
      "confidence": "high",
      "notes": "Em APP_ENV=production, GET /ping retornou 404 e a rota nao fica disponivel publicamente."
    },
    {
      "ac": "AC-008",
      "met": true,
      "confidence": "high",
      "notes": "A validacao de hash falha explicitamente quando um asset obrigatorio nao esta versionado."
    },
    {
      "ac": "AC-009",
      "met": true,
      "confidence": "high",
      "notes": "PHPStan retorna exit diferente de 0 para fixture derivado do Ping com erro de tipo detectavel."
    },
    {
      "ac": "AC-010",
      "met": true,
      "confidence": "high",
      "notes": "livewire:list falha quando o componente ping nao esta registrado na descoberta do Livewire."
    }
  ],
  "ux_findings": [],
  "consistency_findings": [],
  "business_rule_findings": [],
  "next_action": "approved"
}
